{
  "document_type": "이혼소장",

  "header": {
    "title": {
      "text": "소    장",
      "format": {
        "alignment": "center",
        "font_size": 18,
        "bold": true,
        "spacing_after": 2
      }
    },
    "case_number": {
      "text": "",
      "format": {
        "alignment": "left",
        "indent_level": 0,
        "spacing_after": 2
      }
    }
  },

  "parties": {
    "format": {
      "label_width": 10,
      "indent_level": 0,
      "line_spacing": 1.5
    },
    "plaintiff": {
      "label": "원    고",
      "name": "김○○",
      "resident_number": "800101-2******",
      "address": "서울특별시 강남구 테헤란로 123, 456호",
      "registered_address": "서울특별시 종로구 종로 1",
      "contact": "010-1234-5678"
    },
    "defendant": {
      "label": "피    고",
      "name": "이○○",
      "resident_number": "780515-1******",
      "address": "서울특별시 서초구 서초대로 789",
      "registered_address": "경기도 성남시 분당구 판교로 100"
    },
    "children": [
      {
        "label": "사건본인",
        "name": "이△△",
        "birth_date": "2015-03-15",
        "age": 9,
        "address": "서울특별시 강남구 테헤란로 123, 456호"
      }
    ]
  },

  "claims": {
    "section_title": {
      "text": "청 구 취 지",
      "format": {
        "alignment": "center",
        "bold": true,
        "spacing_before": 2,
        "spacing_after": 1
      }
    },
    "items": [
      {
        "number": "1.",
        "text": "원고와 피고는 이혼한다.",
        "format": {
          "indent_level": 1,
          "indent_chars": 4,
          "hanging_indent": true,
          "line_break_after": true
        }
      },
      {
        "number": "2.",
        "text": "사건본인 이△△에 대한 친권자 및 양육자로 원고를 지정한다.",
        "format": {
          "indent_level": 1,
          "indent_chars": 4,
          "hanging_indent": true,
          "line_break_after": true
        }
      },
      {
        "number": "3.",
        "text": "피고는 원고에게 사건본인에 대한 양육비로 이 판결 확정일부터 사건본인이 성년에 이르기 전날까지 매월 100만원을 매월 말일에 지급하라.",
        "format": {
          "indent_level": 1,
          "indent_chars": 4,
          "hanging_indent": true,
          "line_break_after": true
        }
      },
      {
        "number": "4.",
        "text": "피고는 원고에게 위자료로 금 30,000,000원 및 이에 대하여 이 사건 소장 부본 송달일 다음날부터 다 갚는 날까지 연 12%의 비율에 의한 금원을 지급하라.",
        "format": {
          "indent_level": 1,
          "indent_chars": 4,
          "hanging_indent": true,
          "line_break_after": true
        }
      },
      {
        "number": "5.",
        "text": "소송비용은 피고가 부담한다.",
        "format": {
          "indent_level": 1,
          "indent_chars": 4,
          "hanging_indent": true,
          "line_break_after": true
        }
      }
    ],
    "closing": {
      "text": "라는 판결을 구합니다.",
      "format": {
        "alignment": "left",
        "indent_level": 0,
        "spacing_after": 2
      }
    }
  },

  "grounds": {
    "section_title": {
      "text": "청 구 원 인",
      "format": {
        "alignment": "center",
        "bold": true,
        "spacing_before": 2,
        "spacing_after": 1
      }
    },
    "sections": [
      {
        "number": "1.",
        "title": "당사자들의 관계",
        "format": {
          "title_bold": true,
          "indent_level": 0,
          "spacing_before": 1,
          "spacing_after": 0
        },
        "paragraphs": [
          {
            "text": "원고와 피고는 2010. 5. 20. 혼인신고를 마친 법률상 부부로서, 그 사이에 사건본인 이△△(2015. 3. 15.생)을 두고 있습니다.",
            "evidence_refs": ["갑 제1호증", "갑 제2호증"],
            "format": {
              "indent_level": 1,
              "indent_first_line": 2,
              "line_spacing": 1.6,
              "spacing_after": 1
            }
          }
        ]
      },
      {
        "number": "2.",
        "title": "혼인생활의 경과",
        "format": {
          "title_bold": true,
          "indent_level": 0,
          "spacing_before": 1,
          "spacing_after": 0
        },
        "paragraphs": [
          {
            "text": "원고와 피고는 혼인 초기에는 원만한 부부생활을 영위하였으나, 2020년경부터 피고의 잦은 음주와 폭언으로 인하여 부부관계가 악화되기 시작하였습니다.",
            "evidence_refs": [],
            "format": {
              "indent_level": 1,
              "indent_first_line": 2,
              "line_spacing": 1.6,
              "spacing_after": 1
            }
          }
        ]
      },
      {
        "number": "3.",
        "title": "이혼 사유 (혼인파탄의 경위)",
        "format": {
          "title_bold": true,
          "indent_level": 0,
          "spacing_before": 1,
          "spacing_after": 0
        },
        "paragraphs": [
          {
            "text": "피고는 2023. 8. 15. 원고에게 \"집에서 나가라\", \"네가 뭔데\"라는 등의 폭언을 하였고, 이후로도 지속적으로 원고의 인격을 무시하는 발언을 반복하였습니다.",
            "evidence_refs": ["갑 제3호증"],
            "format": {
              "indent_level": 1,
              "indent_first_line": 2,
              "line_spacing": 1.6,
              "spacing_after": 1
            }
          },
          {
            "text": "또한 피고는 2023. 11. 20. 새벽 2시경 술에 취한 상태로 귀가하여 원고에게 \"죽여버리겠다\"라고 협박하였으며, 이로 인하여 원고는 극심한 공포와 정신적 고통을 받았습니다.",
            "evidence_refs": ["갑 제4호증", "갑 제5호증"],
            "format": {
              "indent_level": 1,
              "indent_first_line": 2,
              "line_spacing": 1.6,
              "spacing_after": 1
            }
          }
        ],
        "legal_basis": {
          "statute": "민법",
          "article": "제840조",
          "clause": "제3호, 제6호",
          "content": "배우자 또는 그 직계존속으로부터 심히 부당한 대우를 받았을 때, 그 밖에 혼인을 계속하기 어려운 중대한 사유가 있을 때",
          "format": {
            "style": "inline",
            "indent_level": 2
          }
        }
      },
      {
        "number": "4.",
        "title": "친권 및 양육권",
        "format": {
          "title_bold": true,
          "indent_level": 0,
          "spacing_before": 1,
          "spacing_after": 0
        },
        "paragraphs": [
          {
            "text": "사건본인은 출생 이후 주로 원고의 보살핌 아래 성장하였고, 현재 초등학교에 재학 중입니다. 피고의 잦은 음주와 폭언은 사건본인에게도 정서적 악영향을 미치고 있어, 사건본인의 복리를 위하여 원고를 친권자 및 양육자로 지정하는 것이 적절합니다.",
            "evidence_refs": [],
            "format": {
              "indent_level": 1,
              "indent_first_line": 2,
              "line_spacing": 1.6,
              "spacing_after": 1
            }
          }
        ]
      },
      {
        "number": "5.",
        "title": "위자료 청구",
        "format": {
          "title_bold": true,
          "indent_level": 0,
          "spacing_before": 1,
          "spacing_after": 0
        },
        "paragraphs": [
          {
            "text": "피고의 위와 같은 유책행위로 인하여 원고는 심각한 정신적 고통을 받았으므로, 피고는 원고에게 위자료로 금 30,000,000원을 지급할 의무가 있습니다.",
            "evidence_refs": [],
            "format": {
              "indent_level": 1,
              "indent_first_line": 2,
              "line_spacing": 1.6,
              "spacing_after": 1
            }
          }
        ]
      },
      {
        "number": "6.",
        "title": "결론",
        "format": {
          "title_bold": true,
          "indent_level": 0,
          "spacing_before": 1,
          "spacing_after": 0
        },
        "paragraphs": [
          {
            "text": "이상과 같이 피고의 귀책사유로 인하여 원고와 피고 사이의 혼인관계는 회복할 수 없을 정도로 파탄되었으므로, 원고는 이 사건 소를 제기하기에 이르렀습니다.",
            "evidence_refs": [],
            "format": {
              "indent_level": 1,
              "indent_first_line": 2,
              "line_spacing": 1.6,
              "spacing_after": 1
            }
          }
        ]
      }
    ]
  },

  "evidence": {
    "section_title": {
      "text": "입 증 방 법",
      "format": {
        "alignment": "center",
        "bold": true,
        "spacing_before": 2,
        "spacing_after": 1
      }
    },
    "items": [
      {
        "number": "갑 제1호증",
        "description": "혼인관계증명서",
        "source": "정부24",
        "format": {
          "indent_level": 1,
          "number_width": 12,
          "separator": "  "
        }
      },
      {
        "number": "갑 제2호증",
        "description": "가족관계증명서",
        "source": "정부24",
        "format": {
          "indent_level": 1,
          "number_width": 12,
          "separator": "  "
        }
      },
      {
        "number": "갑 제3호증",
        "description": "카카오톡 대화내역 (2023. 8. 15.)",
        "source": "원고 휴대전화",
        "format": {
          "indent_level": 1,
          "number_width": 12,
          "separator": "  "
        }
      },
      {
        "number": "갑 제4호증",
        "description": "카카오톡 대화내역 (2023. 11. 20.)",
        "source": "원고 휴대전화",
        "format": {
          "indent_level": 1,
          "number_width": 12,
          "separator": "  "
        }
      },
      {
        "number": "갑 제5호증",
        "description": "녹음 파일 및 녹취록",
        "source": "원고 휴대전화",
        "format": {
          "indent_level": 1,
          "number_width": 12,
          "separator": "  "
        }
      }
    ]
  },

  "attachments": {
    "section_title": {
      "text": "첨 부 서 류",
      "format": {
        "alignment": "center",
        "bold": true,
        "spacing_before": 2,
        "spacing_after": 1
      }
    },
    "items": [
      {
        "number": "1.",
        "description": "위 입증방법",
        "quantity": "각 1통",
        "format": {
          "indent_level": 1,
          "quantity_alignment": "right"
        }
      },
      {
        "number": "2.",
        "description": "소장 부본",
        "quantity": "1통",
        "format": {
          "indent_level": 1,
          "quantity_alignment": "right"
        }
      },
      {
        "number": "3.",
        "description": "송달료 납부서",
        "quantity": "1통",
        "format": {
          "indent_level": 1,
          "quantity_alignment": "right"
        }
      }
    ]
  },

  "footer": {
    "date": {
      "text": "2024. 12. 3.",
      "format": {
        "alignment": "center",
        "spacing_before": 3,
        "spacing_after": 2
      }
    },
    "signature": {
      "role": "원고",
      "name": "김○○",
      "seal": "(인)",
      "format": {
        "alignment": "right",
        "spacing_after": 3
      }
    },